{
  "$schema": "https://github.com/bitjungle/gopca/schemas/v1/pca-output.schema.json",
  "metadata": {
    "analysis_id": "103abfdf-7853-4686-afda-cb7d78db8105",
    "software_version": "v1.0.1-7-g49c2ab9",
    "created_at": "2025-09-02T22:48:26+02:00",
    "software": "gopca",
    "config": {
      "method": "",
      "n_components": 0,
      "missing_strategy": "error"
    },
    "data_source": {
      "filename": "iris.csv",
      "n_rows_original": 150,
      "n_cols_original": 4
    }
  },
  "preprocessing": {
    "mean_center": true,
    "standard_scale": false,
    "robust_scale": false,
    "scale_only": false,
    "snv": false,
    "vector_norm": false,
    "parameters": {
      "feature_means": [
        5.843333333333335,
        3.057333333333334,
        3.7580000000000027,
        1.199333333333334
      ],
      "feature_stddevs": [
        0.8280661279778629,
        0.435866284936698,
        1.7652982332594667,
        0.7622376689603465
      ],
      "feature_medians": [
        0,
        0,
        0,
        0
      ],
      "feature_mads": [
        0,
        0,
        0,
        0
      ]
    }
  },
  "model": {
    "loadings": [
      [
        0.19752722495215774,
        -0.3361433228451565,
        0.426778172546033,
        -0.37983005667006514,
        0.13690649370595742,
        0.19832348135100988,
        0.5120554860321196,
        -0.27497034102294216,
        0.2149818129888188,
        -0.06410793569034844,
        0.23037888220323202,
        0.14931056294196224
      ],
      [
        -0.06063677750569635,
        -0.1265697118915028,
        0.14294056476619157,
        -0.46203912112957646,
        0.5311145746984225,
        -0.2528259289485254,
        -0.06013466669500391,
        0.5239844699297872,
        -0.10684388614030839,
        0.08723410499771628,
        -0.30033089245746847,
        -0.11396288877986395
      ]
    ],
    "explained_variance": null,
    "explained_variance_ratio": null,
    "cumulative_variance": null,
    "component_labels": null,
    "feature_labels": [
      "sepal length (cm)",
      "sepal width (cm)",
      "petal length (cm)",
      "petal width (cm)"
    ]
  },
  "results": {
    "samples": {
      "names": [
        "0",
        "1",
        "2",
        "3",
        "4",
        "5",
        "6",
        "7",
        "8",
        "9",
        "10",
        "11",
        "12",
        "13",
        "14",
        "15",
        "16",
        "17",
        "18",
        "19",
        "20",
        "21",
        "22",
        "23",
        "24",
        "25",
        "26",
        "27",
        "28",
        "29",
        "30",
        "31",
        "32",
        "33",
        "34",
        "35",
        "36",
        "37",
        "38",
        "39",
        "40",
        "41",
        "42",
        "43",
        "44",
        "45",
        "46",
        "47",
        "48",
        "49",
        "50",
        "51",
        "52",
        "53",
        "54",
        "55",
        "56",
        "57",
        "58",
        "59",
        "60",
        "61",
        "62",
        "63",
        "64",
        "65",
        "66",
        "67",
        "68",
        "69",
        "70",
        "71",
        "72",
        "73",
        "74",
        "75",
        "76",
        "77",
        "78",
        "79",
        "80",
        "81",
        "82",
        "83",
        "84",
        "85",
        "86",
        "87",
        "88",
        "89",
        "90",
        "91",
        "92",
        "93",
        "94",
        "95",
        "96",
        "97",
        "98",
        "99",
        "100",
        "101",
        "102",
        "103",
        "104",
        "105",
        "106",
        "107",
        "108",
        "109",
        "110",
        "111",
        "112",
        "113",
        "114",
        "115",
        "116",
        "117",
        "118",
        "119",
        "120",
        "121",
        "122",
        "123",
        "124",
        "125",
        "126",
        "127",
        "128",
        "129",
        "130",
        "131",
        "132",
        "133",
        "134",
        "135",
        "136",
        "137",
        "138",
        "139",
        "140",
        "141",
        "142",
        "143",
        "144",
        "145",
        "146",
        "147",
        "148",
        "149"
      ],
      "scores": [
        [
          -4.794782837348726,
          -0.05304833804148816
        ],
        [
          -4.819425322391911,
          -0.041407696913550035
        ],
        [
          -4.837147977810981,
          -0.11229016339564889
        ],
        [
          -4.50351302064535,
          -0.07863484481122418
        ],
        [
          -4.546873766239107,
          0.5969247249494701
        ],
        [
          -4.485108104712717,
          -0.5342591054739648
        ],
        [
          -4.811694369374337,
          0.4142676034793749
        ],
        [
          -4.727387873903458,
          -0.42234567446359617
        ],
        [
          -4.6697782444727585,
          -0.01071160070507923
        ],
        [
          -4.520427891748116,
          0.40107033268045617
        ],
        [
          -4.581617382311174,
          -0.10580281907260264
        ],
        [
          -4.974145567280979,
          0.13217611731320722
        ],
        [
          -5.017521370592177,
          -0.8010482304886454
        ],
        [
          -4.815927944992011,
          0.4662075579784555
        ],
        [
          -4.487891303543381,
          0.202958206729104
        ],
        [
          -4.473697707691066,
          -0.15908407507388375
        ],
        [
          -4.361581486301317,
          -0.44534616456334514
        ],
        [
          -4.334441470853579,
          0.46881083008636326
        ],
        [
          -4.140767042621921,
          -0.373348819230869
        ],
        [
          -4.331227735464826,
          0.14712993357285534
        ],
        [
          -4.683416865223816,
          0.1651686928555646
        ],
        [
          -4.677253007669753,
          -0.6051174034021016
        ],
        [
          -4.561500961647973,
          0.3999885932451165
        ],
        [
          -4.145693761413444,
          0.002407679005645126
        ],
        [
          -4.243220124225797,
          -0.10701957411396316
        ],
        [
          -4.369679241523114,
          0.02408172281533439
        ],
        [
          -4.454212860075388,
          0.034314043287178006
        ],
        [
          -4.542393050527883,
          0.07175864940548221
        ],
        [
          -4.546562948553971,
          -0.12748739295823727
        ],
        [
          -4.4172894947801895,
          -0.16571022640971902
        ],
        [
          -4.444706131450985,
          0.18618984380968184
        ],
        [
          -4.4732737471228665,
          -0.1539067573106473
        ],
        [
          -4.593927213338603,
          0.3041398994719162
        ],
        [
          -4.705563789109816,
          -0.280681941064041
        ],
        [
          -4.715429689008155,
          -0.25659027942174756
        ],
        [
          -4.816069837632874,
          0.33021040450938066
        ],
        [
          -4.8689883996031815,
          0.06458750337197716
        ],
        [
          -4.844638741880387,
          -0.5089810126759255
        ],
        [
          -4.827018167339432,
          0.3810948065956355
        ],
        [
          -4.740946314016607,
          0.21899860129286508
        ],
        [
          -4.966336827421705,
          -0.305559159176572
        ],
        [
          -4.757135977176472,
          -0.1782636902982887
        ],
        [
          -4.411987601657661,
          0.23984463857101582
        ],
        [
          -4.246606692398375,
          0.4103986775421097
        ],
        [
          -4.331004657363901,
          -0.5435143325100761
        ],
        [
          -4.682287260146931,
          0.486957491643734
        ],
        [
          -4.599266942273067,
          -0.5612177586423521
        ],
        [
          -4.688046554771659,
          0.43962503124136215
        ],
        [
          -2.3369937411934805,
          -1.5544143862657036
        ],
        [
          -0.32115822933421634,
          1.7948136195910185
        ],
        [
          2.082231411033899,
          -0.5182384093896558
        ],
        [
          1.4785020002185019,
          0.921241216212262
        ],
        [
          1.5686830966163474,
          -1.2768891751284288
        ],
        [
          1.1097512698766308,
          0.8317412434884188
        ],
        [
          1.617247540824929,
          -0.577522743258984
        ],
        [
          0.5828607889846369,
          1.1911731124973304
        ],
        [
          0.7951385635642018,
          -1.8053659682019434
        ],
        [
          0.17786226196334226,
          1.5756437544118564
        ],
        [
          0.32754142332621405,
          -0.34646805678625886
        ],
        [
          0.01884820607531196,
          -0.7619542278852494
        ],
        [
          0.17321760548321466,
          0.7974795678333718
        ],
        [
          1.0134107982995268,
          -0.43299987925031846
        ],
        [
          0.6256197942673034,
          0.7491044671744252
        ],
        [
          0.986540978449068,
          -0.9939716593381691
        ],
        [
          0.8040457107131292,
          0.8864591337991541
        ],
        [
          1.0457691707203727,
          -0.22355416317197144
        ],
        [
          1.0687421495678238,
          -0.28537515640662797
        ],
        [
          0.7198915289155668,
          0.5444950004432585
        ],
        [
          1.2215813904940336,
          -0.7135497606435562
        ],
        [